{
  "$schema": "https://json-schema.org/draft/2020-12/schema",
  "$id": "https://luminaryworks.dev/schemas/embed-origin-allowlist.v1.json",
  "title": "DataLuminary embed origin allowlist",
  "type": "object",
  "additionalProperties": false,
  "required": [
    "product",
    "frameAncestors",
    "browserMustNotHold",
    "authority"
  ],
  "properties": {
    "product": {
      "const": "dataluminary"
    },
    "frameAncestors": {
      "type": "array",
      "minItems": 1,
      "items": {
        "type": "string",
        "pattern": "^https://[a-z0-9.-]+(?::[0-9]+)?$"
      }
    },
    "browserMustNotHold": {
      "type": "array",
      "items": {
        "type": "string"
      }
    },
    "authority": {
      "type": "string"
    }
  }
}
